{
  "$schema": "./rich-text-behavior-v1.schema.json",
  "contract": "wenyousite-rich-text-behavior",
  "version": 1,
  "markdownContractVersion": 5,
  "scope": "synthetic-test-and-diagnostic-only",
  "positionEncoding": "utf16-text-softbreak-and-atom-width-1",
  "references": [
    {
      "file": "markdown-editor-newline-v1-fixtures.json",
      "version": 1,
      "revision": 2,
      "consume": "all-15-cases-and-27-editCases"
    },
    {
      "file": "markdown-editor-roundtrip-v7-fixtures.json",
      "version": 7,
      "consume": "all-30-cases-and-48-editCases-and-inlineInsertTexts"
    },
    {
      "file": "markdown-v4-nodes-fixtures.json",
      "version": 1,
      "consume": "all-cases-and-identityRules"
    },
    {
      "file": "editor-clipboard-v2-fixtures.json",
      "version": 2,
      "consume": "all-entryPoints-pasteRules-nodeRules-goldenCases"
    }
  ],
  "profiles": {
    "legacy-v3": {
      "markdownVersions": [
        3
      ],
      "features": [
        "base"
      ],
      "evidence": "declared-minimum-not-a-specific-client-build"
    },
    "legacy-v4": {
      "markdownVersions": [
        3,
        4
      ],
      "features": [
        "base",
        "block-alignment"
      ],
      "evidence": "declared-minimum-not-a-specific-client-build"
    },
    "legacy-v5": {
      "markdownVersions": [
        3,
        4,
        5
      ],
      "features": [
        "base",
        "block-alignment",
        "image-alignment"
      ],
      "evidence": "version-alone-does-not-prove-newline-r2-or-lossless-guard"
    },
    "candidate-v5": {
      "markdownVersions": [
        3,
        4,
        5
      ],
      "features": [
        "base",
        "block-alignment",
        "image-alignment",
        "quote-empty-row",
        "newline-r2",
        "lossless-save-guard"
      ],
      "evidence": "requires-consumer-test-results-before-release"
    }
  },
  "cases": [
    {
      "id": "rtb-soft-manual-boundary",
      "family": "boundaries",
      "source": "synthetic-rule-example",
      "rules": [
        "newline-v1-r2",
        "RTM-03"
      ],
      "profile": "candidate-v5",
      "initial": {
        "canonical": "[wenyousite-align-v1-center]: #\n甲\n乙",
        "summary": {
          "blocks": [
            {
              "type": "paragraph",
              "alignment": "center",
              "children": [
                {
                  "type": "text",
                  "text": "甲",
                  "marks": {}
                },
                {
                  "type": "softBreak"
                },
                {
                  "type": "text",
                  "text": "乙",
                  "marks": {}
                }
              ]
            }
          ]
        },
        "selection": {
          "anchor": {
            "path": [
              0
            ],
            "offset": 3
          },
          "focus": {
            "path": [
              0
            ],
            "offset": 3
          }
        }
      },
      "steps": [
        {
          "id": "enter",
          "operation": {
            "type": "enter"
          },
          "expected": {
            "canonical": "[wenyousite-align-v1-center]: #\n甲\n乙\n<br />",
            "summary": {
              "blocks": [
                {
                  "type": "paragraph",
                  "alignment": "center",
                  "children": [
                    {
                      "type": "text",
                      "text": "甲",
                      "marks": {}
                    },
                    {
                      "type": "softBreak"
                    },
                    {
                      "type": "text",
                      "text": "乙",
                      "marks": {}
                    }
                  ]
                },
                {
                  "type": "paragraph",
                  "alignment": "left",
                  "children": []
                }
              ]
            },
            "selection": {
              "anchor": {
                "path": [
                  1
                ],
                "offset": 0
              },
              "focus": {
                "path": [
                  1
                ],
                "offset": 0
              }
            }
          }
        },
        {
          "id": "continue",
          "operation": {
            "type": "insertText",
            "text": "丙"
          },
          "expected": {
            "canonical": "[wenyousite-align-v1-center]: #\n甲\n乙\n\n丙",
            "summary": {
              "blocks": [
                {
                  "type": "paragraph",
                  "alignment": "center",
                  "children": [
                    {
                      "type": "text",
                      "text": "甲",
                      "marks": {}
                    },
                    {
                      "type": "softBreak"
                    },
                    {
                      "type": "text",
                      "text": "乙",
                      "marks": {}
                    }
                  ]
                },
                {
                  "type": "paragraph",
                  "alignment": "left",
                  "children": [
                    {
                      "type": "text",
                      "text": "丙",
                      "marks": {}
                    }
                  ]
                }
              ]
            },
            "selection": {
              "anchor": {
                "path": [
                  1
                ],
                "offset": 1
              },
              "focus": {
                "path": [
                  1
                ],
                "offset": 1
              }
            }
          }
        },
        {
          "id": "reopen",
          "operation": {
            "type": "reopen"
          },
          "expected": {
            "canonical": "[wenyousite-align-v1-center]: #\n甲\n乙\n\n丙",
            "summary": {
              "blocks": [
                {
                  "type": "paragraph",
                  "alignment": "center",
                  "children": [
                    {
                      "type": "text",
                      "text": "甲",
                      "marks": {}
                    },
                    {
                      "type": "softBreak"
                    },
                    {
                      "type": "text",
                      "text": "乙",
                      "marks": {}
                    }
                  ]
                },
                {
                  "type": "paragraph",
                  "alignment": "left",
                  "children": [
                    {
                      "type": "text",
                      "text": "丙",
                      "marks": {}
                    }
                  ]
                }
              ]
            }
          }
        }
      ]
    },
    {
      "id": "rtb-quote-paragraph-membership",
      "family": "boundaries",
      "source": "synthetic-rule-example",
      "rules": [
        "newline-v1-r2",
        "RTM-04"
      ],
      "profile": "candidate-v5",
      "initial": {
        "canonical": "> 甲\n>\n> 乙",
        "summary": {
          "blocks": [
            {
              "type": "blockquote",
              "children": [
                {
                  "type": "paragraph",
                  "alignment": "left",
                  "children": [
                    {
                      "type": "text",
                      "text": "甲",
                      "marks": {}
                    }
                  ]
                },
                {
                  "type": "paragraph",
                  "alignment": "left",
                  "children": [
                    {
                      "type": "text",
                      "text": "乙",
                      "marks": {}
                    }
                  ]
                }
              ]
            }
          ]
        },
        "selection": {
          "anchor": {
            "path": [
              0,
              1
            ],
            "offset": 0
          },
          "focus": {
            "path": [
              0,
              1
            ],
            "offset": 0
          }
        }
      },
      "steps": [
        {
          "id": "insert",
          "operation": {
            "type": "insertText",
            "text": "新"
          },
          "expected": {
            "canonical": "> 甲\n>\n> 新乙",
            "summary": {
              "blocks": [
                {
                  "type": "blockquote",
                  "children": [
                    {
                      "type": "paragraph",
                      "alignment": "left",
                      "children": [
                        {
                          "type": "text",
                          "text": "甲",
                          "marks": {}
                        }
                      ]
                    },
                    {
                      "type": "paragraph",
                      "alignment": "left",
                      "children": [
                        {
                          "type": "text",
                          "text": "新乙",
                          "marks": {}
                        }
                      ]
                    }
                  ]
                }
              ]
            },
            "selection": {
              "anchor": {
                "path": [
                  0,
                  1
                ],
                "offset": 1
              },
              "focus": {
                "path": [
                  0,
                  1
                ],
                "offset": 1
              }
            }
          }